{
  "page": 26,
  "book_page": 62,
  "raw_response": "Based on the comparison between the original image and the OCR result, here is the quality analysis:\n\nThe OCR extraction is **Excellent**.\nThe structural parsing, section numbering, source extraction, and handling of text flow (RTL columns) are all correct. The extraction of the \"Continues From\" metadata is logically deduced correctly.\n\nI identified one minor transcription error (\"ומנח\" vs \"ומנה\") and a very minor punctuation difference in a citation reference.\n\n### Issues Found\n\n```json\n{\n  \"page\": 46,\n  \"book_page\": 46,\n  \"overall_quality\": \"excellent\",\n  \"summary\": \"High-quality extraction. Structure, sectioning, and source isolation were handled perfectly. Two minor text discrepancies were found in section 89 (one character substitution and one punctuation mark).\",\n  \"issues\": [\n    {\n      \"type\": \"wrong_text\",\n      \"severity\": \"minor\",\n      \"location\": \"Section פט (89), Paragraph 1, line 1\",\n      \"description\": \"Transcription error. The word 'ומנח' (and rested?) appears in the OCR, but the image shows 'ומנה' (and counted/listed - Heh instead of Chet), which corresponds to the Talmudic phrase 'ומנה ושייר'.\",\n      \"original_text\": \"ומנח ושייר\",\n      \"corrected_text\": \"ומנה ושייר\"\n    },\n    {\n      \"type\": \"wrong_text\",\n      \"severity\": \"minor\",\n      \"location\": \"Section פט (89), Paragraph 1, inside citation\",\n      \"description\": \"Punctuation mismatch. The OCR transcribed the citation as '(רמב\\\"ן קידושין לד:)', but the image shows a period/dot '(רמב\\\"ן קידושין לד.)'.\",\n      \"original_text\": \"(רמב\\\"ן קידושין לד:)\",\n      \"corrected_text\": \"(רמב\\\"ן קידושין לד.)\"\n    }\n  ],\n  \"corrected_json\": {\n    \"meta\": {\n      \"book_title\": \"שכר מצוה\",\n      \"page_number\": \"מו\",\n      \"page_side\": \"left\",\n      \"chapter_context\": \"פרק שלישי\",\n      \"continues_from\": {\n        \"flag\": true,\n        \"section_letter\": \"פח\",\n        \"level\": \"body_paragraph\"\n      },\n      \"continues_to\": {\n        \"flag\": false,\n        \"section_letter\": null,\n        \"level\": null\n      }\n    },\n    \"data\": [\n      {\n        \"type\": \"continuation_fragment\",\n        \"text\": \"מצות בוראו וכו' יש לו שכר בעוה\\\"ז.\",\n        \"source_ref\": \"פנים יפות לך\"\n      },\n      {\n        \"type\": \"section\",\n        \"number\": \"פט\",\n        \"title\": \"על מצות ראיה\",\n        \"paragraphs\": [\n          {\n            \"is_makor\": true,\n            \"text\": \"ומנה ושייר וכו' שמ\\\"ע שהז\\\"ג וכו' שייר לראיה וכו' (רמב\\\"ן קידושין לד.). וכתב הגרש\\\"ק ז\\\"ל וז\\\"ק: אבל באלו המצות שהזמן גרמא בהם לנשים רק עבור חיי העוה\\\"ז בהם יש שכר מצוה בהאי עלמא וכו'.\",\n            \"source_ref\": \"שו\\\"ת קנאת סופרים סימן צ\\\"ה ובשו\\\"ת שנות חיים קכ\\\"ג\"\n          }\n        ]\n      },\n      {\n        \"type\": \"section\",\n        \"number\": \"צ\",\n        \"title\": \"על מצות קרבן פסח\",\n        \"paragraphs\": [\n          {\n            \"is_makor\": true,\n            \"text\": \"על פסח וכו' הרי יש עונש כרת על ביטולו וא\\\"כ שפיר מגיע עליהם שכר בעוה\\\"ז.\",\n            \"source_ref\": \"בקובץ 'חדשים גם ישנים' חוברת ד', סימן קנ\\\"ה בשם ה'לב אריה'\"\n          }\n        ]\n      },\n      {\n        \"type\": \"section\",\n        \"number\": \"צא\",\n        \"title\": \"על מצות מצה\",\n        \"paragraphs\": [\n          {\n            \"is_makor\": true,\n            \"text\": \"ובכלל הוא הרי מצה וכו' למ\\\"ע שהז\\\"ג וכו' (קידושין לד.). וכתב הגרש\\\"ק ז\\\"ל וז\\\"ק: אבל באלו המצות שהזמן גרמא בהם לנשים רק עבור חיי העוה\\\"ז בהם יש שכר מצוה בהאי עלמא וכו'.\",\n            \"source_ref\": \"שו\\\"ת קנאת סופרים סימן צ\\\"ה ובשו\\\"ת שנות חיים קכ\\\"ג\"\n          }\n        ]\n      },\n      {\n        \"type\": \"section\",\n        \"number\": \"צב\",\n        \"title\": \"על ידי האפיקומן\",\n        \"paragraphs\": [\n          {\n            \"is_makor\": true,\n            \"text\": \"דע\\\"י האפיקומן יגיע שכר בהאי עלמא וכו'.\",\n            \"source_ref\": \"אמרי יצחק תולדות\"\n          }\n        ]\n      },\n      {\n        \"type\": \"section\",\n        \"number\": \"צג\",\n        \"title\": \"על מצות ספירת העומר\",\n        \"paragraphs\": [\n          {\n            \"is_makor\": true,\n            \"text\": \"כתב הגרש\\\"ק ז\\\"ל וז\\\"ק: אבל באלו המצות שהזמן גרמא בהם לנשים רק עבור חיי העוה\\\"ז בהם יש שכר מצוה בהאי עלמא וכו'.\",\n            \"source_ref\": \"שו\\\"ת קנאת סופרים סימן צ\\\"ה ובשו\\\"ת שנות חיים קכ\\\"ג\"\n          }\n        ]\n      },\n      {\n        \"type\": \"section\",\n        \"number\": \"צד\",\n        \"title\": \"על מצות שופר\",\n        \"paragraphs\": [\n          {\n            \"is_makor\": true,\n            \"text\": \"ת\\\"ר איזהו מ\\\"ע שהז\\\"ג וכו' שופר וכו' (קידושין לג:). וכתב הגרש\\\"ק ז\\\"ל וז\\\"ק: אבל באלו המצות שהזמן גרמא בהם לנשים רק עבור חיי העוה\\\"ז בהם יש שכר מצוה בהאי עלמא וכו'.\",\n            \"source_ref\": \"שו\\\"ת קנאת סופרים סימן צ\\\"ה ובשו\\\"ת שנות חיים קכ\\\"ג\"\n          }\n        ]\n      },\n      {\n        \"type\": \"section\",\n        \"number\": \"צה\",\n        \"title\": \"על מצות סוכה\",\n        \"paragraphs\": [\n          {\n            \"is_makor\": true,\n            \"text\": \"אף ששכר מצוה בהאי עלמא ליכא, סגולה של ימי הסוכה וכו'\"\n          }\n        ]\n      }\n    ]\n  }\n}\n```",
  "parsed_qa": {
    "page": 46,
    "book_page": 46,
    "overall_quality": "excellent",
    "summary": "High-quality extraction. Structure, sectioning, and source isolation were handled perfectly. Two minor text discrepancies were found in section 89 (one character substitution and one punctuation mark).",
    "issues": [
      {
        "type": "wrong_text",
        "severity": "minor",
        "location": "Section פט (89), Paragraph 1, line 1",
        "description": "Transcription error. The word 'ומנח' (and rested?) appears in the OCR, but the image shows 'ומנה' (and counted/listed - Heh instead of Chet), which corresponds to the Talmudic phrase 'ומנה ושייר'.",
        "original_text": "ומנח ושייר",
        "corrected_text": "ומנה ושייר"
      },
      {
        "type": "wrong_text",
        "severity": "minor",
        "location": "Section פט (89), Paragraph 1, inside citation",
        "description": "Punctuation mismatch. The OCR transcribed the citation as '(רמב\"ן קידושין לד:)', but the image shows a period/dot '(רמב\"ן קידושין לד.)'.",
        "original_text": "(רמב\"ן קידושין לד:)",
        "corrected_text": "(רמב\"ן קידושין לד.)"
      }
    ],
    "corrected_json": {
      "meta": {
        "book_title": "שכר מצוה",
        "page_number": "מו",
        "page_side": "left",
        "chapter_context": "פרק שלישי",
        "continues_from": {
          "flag": true,
          "section_letter": "פח",
          "level": "body_paragraph"
        },
        "continues_to": {
          "flag": false,
          "section_letter": null,
          "level": null
        }
      },
      "data": [
        {
          "type": "continuation_fragment",
          "text": "מצות בוראו וכו' יש לו שכר בעוה\"ז.",
          "source_ref": "פנים יפות לך"
        },
        {
          "type": "section",
          "number": "פט",
          "title": "על מצות ראיה",
          "paragraphs": [
            {
              "is_makor": true,
              "text": "ומנה ושייר וכו' שמ\"ע שהז\"ג וכו' שייר לראיה וכו' (רמב\"ן קידושין לד.). וכתב הגרש\"ק ז\"ל וז\"ק: אבל באלו המצות שהזמן גרמא בהם לנשים רק עבור חיי העוה\"ז בהם יש שכר מצוה בהאי עלמא וכו'.",
              "source_ref": "שו\"ת קנאת סופרים סימן צ\"ה ובשו\"ת שנות חיים קכ\"ג"
            }
          ]
        },
        {
          "type": "section",
          "number": "צ",
          "title": "על מצות קרבן פסח",
          "paragraphs": [
            {
              "is_makor": true,
              "text": "על פסח וכו' הרי יש עונש כרת על ביטולו וא\"כ שפיר מגיע עליהם שכר בעוה\"ז.",
              "source_ref": "בקובץ 'חדשים גם ישנים' חוברת ד', סימן קנ\"ה בשם ה'לב אריה'"
            }
          ]
        },
        {
          "type": "section",
          "number": "צא",
          "title": "על מצות מצה",
          "paragraphs": [
            {
              "is_makor": true,
              "text": "ובכלל הוא הרי מצה וכו' למ\"ע שהז\"ג וכו' (קידושין לד.). וכתב הגרש\"ק ז\"ל וז\"ק: אבל באלו המצות שהזמן גרמא בהם לנשים רק עבור חיי העוה\"ז בהם יש שכר מצוה בהאי עלמא וכו'.",
              "source_ref": "שו\"ת קנאת סופרים סימן צ\"ה ובשו\"ת שנות חיים קכ\"ג"
            }
          ]
        },
        {
          "type": "section",
          "number": "צב",
          "title": "על ידי האפיקומן",
          "paragraphs": [
            {
              "is_makor": true,
              "text": "דע\"י האפיקומן יגיע שכר בהאי עלמא וכו'.",
              "source_ref": "אמרי יצחק תולדות"
            }
          ]
        },
        {
          "type": "section",
          "number": "צג",
          "title": "על מצות ספירת העומר",
          "paragraphs": [
            {
              "is_makor": true,
              "text": "כתב הגרש\"ק ז\"ל וז\"ק: אבל באלו המצות שהזמן גרמא בהם לנשים רק עבור חיי העוה\"ז בהם יש שכר מצוה בהאי עלמא וכו'.",
              "source_ref": "שו\"ת קנאת סופרים סימן צ\"ה ובשו\"ת שנות חיים קכ\"ג"
            }
          ]
        },
        {
          "type": "section",
          "number": "צד",
          "title": "על מצות שופר",
          "paragraphs": [
            {
              "is_makor": true,
              "text": "ת\"ר איזהו מ\"ע שהז\"ג וכו' שופר וכו' (קידושין לג:). וכתב הגרש\"ק ז\"ל וז\"ק: אבל באלו המצות שהזמן גרמא בהם לנשים רק עבור חיי העוה\"ז בהם יש שכר מצוה בהאי עלמא וכו'.",
              "source_ref": "שו\"ת קנאת סופרים סימן צ\"ה ובשו\"ת שנות חיים קכ\"ג"
            }
          ]
        },
        {
          "type": "section",
          "number": "צה",
          "title": "על מצות סוכה",
          "paragraphs": [
            {
              "is_makor": true,
              "text": "אף ששכר מצוה בהאי עלמא ליכא, סגולה של ימי הסוכה וכו'"
            }
          ]
        }
      ]
    }
  },
  "status": "success"
}